title,score,id,url,comms_num,created,body,timestamp
Why do people feel so comfortable holding FB long-term?,246,9tb027,https://www.reddit.com/r/stocks/comments/9tb027/why_do_people_feel_so_comfortable_holding_fb/,198,1541118696.0,"More than willing to accept I'm wrong on this, and if it isn't obvious, I am pretty biased against FB because I personally hate the company, but I'd like to keep this discussion objective.

I don't see how people think Facebook will stay relevant long-term.

Other big tech companies like Microsoft, Amazon, and Google have an established product/service that would be very hard to recreate. Its unlikely that a college kid could re-invent the Google Search algorithm/write a phone OS like android. Or set up a massive logistics infrastructure like Amazon has. Or make a similar product to Windows or Azure.

Facebook, on the other hand, is a fancy, glorified web forum. There are probably thousands of clones that would work the same or better if all Facebook users migrated over. Why is everyone on Facebook? For most people, the answer is simply ""because everyone else is"". They were the first ""grown-up"" social media site, and that's why they ended up with all the users. 

So what do they bring to the table? A clunky forum-like service. Its true value is the userbase, and they would be nothing without it. If I presented an objectively better version of facebook that cared about your privacy and had no ads called myfriendpals.com and said you should switch over, would you? No because all your friends and family are on Facebook. I wouldn't switch over either.

Now you'd think Facebook would try to treat their users well to encourage them to stay for a long time, but they are constantly in the news being caught fucking them over one way or another to squeeze every bit of possible short-term profit out. The platform is so full of ads and spam that the content you actually logged on to see is buried. Facebook has stopped caring about pleasing its userbase. Its working out for them now, but will it always? I've never met a Facebook fanboy. Everyone uses it because they ""have to"".

If a new platform actually finds a way to get a chunk of Facebook users to bother switching over, it will snowball and people will start leaving Facebook at an exponential rate.

I know they have bought out other popular companies, and facebook.com isn't their only source of revenue, but same deal with Instagram. Its a simple platform that doesn't really bring much to the table except the other users which could leave at any time.

What are your thoughts?",2018-11-02 08:31:36
The Dips I'm Buying This Week,36,9wkq3x,https://www.reddit.com/r/stocks/comments/9wkq3x/the_dips_im_buying_this_week/,60,1542103450.0,"Hello! This is my tentative list: AAPL, NVDA, FB, ATVI, & TTWO.  

&#x200B;

I'm waiting on NVDA's earnings to see what happens. If FB hits 140 I'm going to buy more. I don't own AAPL, ATVI, or TTWO. I'm on the fence of adding 3 new stocks to keep track of but I also don't want to miss getting AAPL at this price. The video game market is only going to grow so I figure I should buy these 2 as well after their 20%-30% drops",2018-11-13 18:04:10
An argument for Facebook (FB),25,9wrb3l,https://www.reddit.com/r/stocks/comments/9wrb3l/an_argument_for_facebook_fb/,34,1542160360.0,"There has been a lot of pessimism surrounding the tech industry recently and I truly believe these claims are overblown.

Much of the heat has fallen on the once darling tech company, Facebook, which has fallen over 25% from its ATH.  This correction, while justified, is also extremely exacerbated by the overwhelming (and often redundant) amount of negative news against the social media giant.  Here are my arguments for why Facebook is currently trading at a bargain and why that bargain won't last.

&#x200B;

* ""Senator, we make ads."" Despite your personal gripes with Zuckerburg, there is no denying that this is a man who knows what his company does and more importantly, how his company makes money.  Sure, there have been executives leaving Facebook for artistic choices regarding monetization over the social experience, but as investors, the push for monetization is exactly why this company is a screaming buy.  Facebook and Google combined account for the vast majority of advertising profits.  Though many people loosely throw around the phrase ""printing money"", Facebook seems to be the only company that is quite literally doing that.

&#x200B;

* ""Data is king.""  If data is king, then Facebook is the hard drive.  It is 100% true, the market for Facebook is saturated.  USER GROWTH IS SLOWING.   That makes sense when you're reaching over 2 billion DAUs.  The argument that the company is worth less because user growth is slowing is not just incorrect, but completely foolish and exactly the reason why this company is severely discounted.  Facebook literally has data on almost every single person on the face of this earth.  Yes, they are going to have data breaches.  No company has ever reached the scale in data that Facebook currently commands.  With that comes new challenges that I believe Facebook is actually handling extremely well.

&#x200B;

* Multiple revenue streams is an overlooked given.  I don't want to dwell on this point too much as it will be discussed in a future bullet point.  But Facebook is a titan because it is not a one trick pony.  Long gone are the days of ""Facebook, the social media company.""  Facebook is a conglomerate.  They own subsidiaries that bring in cash and have dormant segments that have yet to be monetized.  The prime examples that come to mind are WhatsApp and Instagram which is currently in its infancy in terms of monetization.

&#x200B;

* Implicit redundancy of users.  Imagine this, 7.53 billion people on the face of this earth, but 10 billion+ using Facebook or a Facebook subsidiary every day.  How is this possible?  Implicit redundancy.  I log into facebook, browse it for a few minutes and get bored before hopping onto IG.  A message pops up on my phone using my Whatsapp messenger.  3 hits, one person.  When, NOT IF, Facebook monetizes these platforms to their fullest capacity (without compromising performance), they will literally be catering to an impossibly large market.  The largest the world has ever seen.

&#x200B;

* Tech Growth and Diversification.  Everything can pretty much be wrapped into here and I'm going to do just that.  The tech sector is slowing down.  But at the same time, its vamping back up.  Facebook is just beginning to dabble in VR and AI.  Personally, I believe AI is the future and VR is an auxiliary function.  But regardless of what I think, they have their hands in the future.  Their diversification feeds back to the idea of them having multiple streams of revenue.  Data they get from one platform can be leveraged to increase the performance of their AI or other sister platforms.  Facebook is becoming a symbiotic being and when AI is fully developed and integrated into a system that ties all their platforms together.  Well, that's Skynet for you.

Honestly, writing this out makes me even more excited for this company.  It is trading lower than I thought it would be trading and I have put my money where my mouth is and have been buying religiously at these levels.  When you invest in Facebook, have no doubt, you are investing in the future.  I do not want to put a monetary value on where the stock will be in a few months or in a year.  But I will tell you that an investment in this company WILL pay off.  In 10 years, Facebook will be around and more prevalent than ever, even if it has a different name.  My investment thesis is still in tact and the fundamentals of this company are as strong as ever.  Facebook long.",2018-11-14 09:52:40
I bought FB stock after the original 20% DIP to 175 ish.,0,9wzrwr,https://www.reddit.com/r/stocks/comments/9wzrwr/i_bought_fb_stock_after_the_original_20_dip_to/,25,1542228281.0,"First, I shouldnt have bought. But now it seems to keep falling and more bad news coming out about it and losing alot of daily users.

Should i cut my losses and sell of my stack or just forget about it? What would you do here?",2018-11-15 04:44:41
Why I think $FB will buy $SPOT soon.,17,9xgdi3,https://www.reddit.com/r/stocks/comments/9xgdi3/why_i_think_fb_will_buy_spot_soon/,27,1542352206.0,"Looking at FB, it is currently sitting on a boatload of cash. Looking at SPOT, it is right now reasonably priced at $25B and losing cash.


With FB's margins, they are able to eat SPOT's current losses and ensure Spotify's mission of capturing market share. 

Also, the sentiment around FB has been pretty ugly. They have only been in the news when they're being attacked for their use of consumer data. I think an acquisition at this level could reverse sentiment as it would signify FB's aggressive approach to future acquisitions and an attempt to diversify their offering.

GOOG, AAPL, AMZN, NFLX, FB are all focused right now on one thing - capturing and retaining consumer's attention. I could see Spotify become an arm for content creation for FB: music, audiobooks, podcasts, news - you name it. Spotify has the clean UI and subscription business model to be a one stop shop for those media.

I also think SPOT is a fantastic fit into FB's overall suite, and would fuel their mission of uniting the world. Heck, music is the world's language.


I'd be interested to see what you all think. Thoughts?",2018-11-16 15:10:06
Facebook - Looking really really tempting now,156,9yi102,https://www.reddit.com/r/stocks/comments/9yi102/facebook_looking_really_really_tempting_now/,258,1542672135.0,"At an almost two year low.  Anyone else buying today?  I've got 5k I've been sitting on for a couple months waiting for a good value buy.  17x forward P/E with a 30% top line growth rate & HUGE economic moat, at least 2B people use one of their products DAILY and there are many opportunities left to monetize (Instagram, FB Marketplace, WhatsApp, FB Stories, etc).",2018-11-20 08:02:15
Who would have thought for the past 3 months BABA and Tencent actually performs better than AMAZON and FB,156,9yy8z4,https://www.reddit.com/r/stocks/comments/9yy8z4/who_would_have_thought_for_the_past_3_months_baba/,40,1542790022.0,"For the past 3 months, 

BABA -18.49%, Tencent -22.87%

AMZN -20.1%, FB -23.28%

&#x200B;

I really thought trade war might not affect the US stock market. I guess I was wrong now",2018-11-21 16:47:02
Is FANG maxed out? The most promising technologies of the next decade (2020 and beyond) and which companies to invest in?,230,a0axqy,https://www.reddit.com/r/stocks/comments/a0axqy/is_fang_maxed_out_the_most_promising_technologies/,118,1543199474.0,"During a bear market, tech and other growth companies are generally the ones that experience the biggest corrections in share prices due to poor fundamentals and high P/E ratios. However, it doesn't change the fact that investing in general is always about future value. Obviously 'future' is subjective and will vary from person to person, as some people are looking to invest for 5 years while others are looking to set-and-forget for 20+ years, but the point is - people are essentially making a long-term bet that the company will evolve into a stronger leader in its respective industry.

FANG (Facebook ($FB), Amazon ($AMZN), Netflix ($NFLX), and Alphabet ($GOOG)) have been the 4 powerhouse tech stocks that consistently beat the market. As of August 10, 2017 — while the NASDAQ 100 was up 19 percent and the S&P 500 was up 8.9 percent year-to-date (YTD) — FANGs were up more than 2x that of the latter. Year-to-date, Facebook (FB) was up 45 percent, Amazon (AMZN) 27 percent, Netflix (NFLX) 36 percent and Alphabet’s Google (GOOG) 16 percent, beating the returns of both indices. (Source: Yahoo Finance)

As we reach the peak of the 'tech bubble', people have questioned whether the year-over-year growth for FANG is sustainable, while others added to their bullish sentiment with the inclusion of other industry leaders -- In Sept. 2018, CNBC published an article that said that Square ($SQ) should be part of the FANG group based on the hyper-bullish sentiment of a Nomura Instinet analyst, who also set a massive price target of $125 per share.

October 2018 - The Motley Fool came out with an article ([https://www.fool.com/investing/2018/10/09/forget-fang-stocks-meet-mana.aspx](https://www.fool.com/investing/2018/10/09/forget-fang-stocks-meet-mana.aspx)) titled \*Forget FANG Stocks: Meet MANA\* (Microsoft ($MSFT), Apple ($AAPL), Netflix ($NFLX), Amazon ($AMZN))

Q3 ERs for most tech companies were disasters - most beat Q2 expectations, but they slipped on the Q4 guidance. Whether you believe that they are sandbagging is up to you, but people hoped that strong ER and Q4 guidance from FANG/FANGS/FAANG/MANA was going to prop up the market from further slide -- they didn't. If I recall correctly, Netflix was the one that had the strongest ER and jumped nearly 13% in the after hours. Apple bombed on their iPhone sales and announced that going forward, they would no longer be reporting iPhone sales unit numbers. People started to question whether FANG had enough innovation left in their tanks to continue to grow and drive expansion.

\*\*So what's next?\*\* There are a number of advancements that are on the verge of a major breakthrough and adoption:

\* Robotics/AI

\* 5G

\* Quantum computing

\* Internet of Things (IoT)

\* Blockchain (this does not necessarily mean cryptocurrencies)

\* Gene editing/modification

\* Healthcare/Biotech/Pharmaceuticals

What technologies are you bullish on for the future? Which companies are you investing for said tech?

EDIT 1: totally forgot about VR/AR",2018-11-26 10:31:14
