title,score,id,url,comms_num,created,body,timestamp
$FB for $MSFT,1,7nsexv,https://www.reddit.com/r/stocks/comments/7nsexv/fb_for_msft/,5,1514984489.0,Thoughts on selling $FB for $MSFT? Microsoft has a  much more diverse revenue stream but Facebook has no dept. ,2018-01-03 21:01:29
BRK.B vs FB vs V,8,7pv54i,https://www.reddit.com/r/stocks/comments/7pv54i/brkb_vs_fb_vs_v/,9,1515772348.0,"Hey everybody, just started investing into individual stocks few weeks ago after a month of research. Looking into investing into companies with a long term approach (15-20+ years). I have 6 shares of MSFT to kick off my portfolio. I plan on owning  shares of BRK.B, FB, and V  at some point and wanted your guys' opinion on which company would be a better buy atm for its relative price and room for growth. ",2018-01-12 23:52:28
FB after newsfeed changes?,3,7pvpnh,https://www.reddit.com/r/stocks/comments/7pvpnh/fb_after_newsfeed_changes/,17,1515781077.0,"So Zuckerberg announced some drastic changed to the Facebook Newsfeed algorithm. To summarize it - friends and family will get priority over ads and media.

Taking this into consideration with the fact that FB have been running out of ad-space - what do we think about the FB stock? Are we still bullish? 

Personally I am not so sure anymore. FB has been beating expectations in growth and rev constantly - which helps it valuation. However, I see a big problem with this shift - this is for me a signal that the newsfeed has reached saturation. 

Question remains - can IG or WA become the new growth engine? ",2018-01-13 02:17:57
$FB 2018 outlook?,28,7r1x8t,https://www.reddit.com/r/stocks/comments/7r1x8t/fb_2018_outlook/,39,1516233520.0,"With all the changes Zuckerburg is doing to FB to combat fake news, to the newsfeed, etc...

Do we think FB is still a long-term hold? Contemplating taking profits and investing elsewhere",2018-01-18 07:58:40
"I own FAAMG, (FB, AMZN, AAPL, MSFT and GOOGL) hold them into earnings?!",11,7rqj5o,https://www.reddit.com/r/stocks/comments/7rqj5o/i_own_faamg_fb_amzn_aapl_msft_and_googl_hold_them/,14,1516485767.0,"I invested $5200 total, about one grand each in these 5 tech giants. Earnings are coming up and just wondering if I should feel uneasy holding these into earnings.",2018-01-21 06:02:47
How do folks seem to know earnings results before the company actually releases earnings? (Example: FB),16,7udh0o,https://www.reddit.com/r/stocks/comments/7udh0o/how_do_folks_seem_to_know_earnings_results_before/,14,1517463275.0,"As I'm writing this FB is down about $10 in the after market. Bidding 177.8 x 177.9 compared to a closing price of 186.89. Volume is pretty significant as well.

However, I'm also sitting here on FB's investor relations page, hitting F5 for a Q4 earnings update and... nothing. How can there possibly be this much trading going on? Is there a source that reports faster than the company's own investor relations page?",2018-02-01 13:34:35
FB,37,7z2red,https://www.reddit.com/r/stocks/comments/7z2red/fb/,91,1519215790.0,FB has dropped a lot recently and is about at its 200 day MA. I understand the election meddling but I feel as if this is priced in right now. What are people’s thoughts? I don’t really see FB/Instagram going away soon.,2018-02-21 20:23:10
$NVDA or $FB. which is a better stock long term to own?,0,81fsrg,https://www.reddit.com/r/stocks/comments/81fsrg/nvda_or_fb_which_is_a_better_stock_long_term_to/,24,1520039554.0,"nvidia or facebook, which is a better long term stock own? i know A.I is supposedly the future, so i'm leaning more to investing in nvidia...",2018-03-03 09:12:34
Blackberry(BB) sues Facebook(FB).,11,82hty7,https://www.reddit.com/r/stocks/comments/82hty7/blackberrybb_sues_facebookfb/,10,1520393445.0,BlackBerry is suing Facebook for patent infringement.  Will this make a difference to either stocks share price?,2018-03-07 11:30:45
FB or ADBE for the long run?,4,85f4pu,https://www.reddit.com/r/stocks/comments/85f4pu/fb_or_adbe_for_the_long_run/,20,1521444447.0,"I have owned both for a while and I plan on selling one of them in the coming weeks, which one should I hold on to for the next 5-10 years?

",2018-03-19 15:27:27
Is FB on sale this morning?,88,85jfmm,https://www.reddit.com/r/stocks/comments/85jfmm/is_fb_on_sale_this_morning/,230,1521494697.0,With everything regarding the Cambridge Analytica scandal and the stock going down 4 percent I think it might be a good deal. I love buying scandals because people forget very quickly it seems. Is this a bad play? ,2018-03-20 05:24:57
will $FB ever be a $200 stock?,20,85jhzq,https://www.reddit.com/r/stocks/comments/85jhzq/will_fb_ever_be_a_200_stock/,42,1521495362.0,"it seems like $FB has has had a price target of $200+ for a long time, but the stock has not been able to clear that hurdle",2018-03-20 05:36:02
Buy FB on the dip?,1,85o5cp,https://www.reddit.com/r/stocks/comments/85o5cp/buy_fb_on_the_dip/,0,1521531066.0,"After dropping around 7% today, Facebook's security chief announced he is leaving. Buying opportunity or wait for a better entry point?",2018-03-20 15:31:06
Instagram opens shopping options!,17,85tiyu,https://www.reddit.com/r/stocks/comments/85tiyu/instagram_opens_shopping_options/,8,1521588128.0,"[link](https://www.google.com/amp/s/venturebeat.com/2018/03/20/shopping-on-instagram-opens-to-merchants-in-8-new-markets-including-canada-brazil-and-the-u-k/amp/) damn was waiting for this a long time! 

Edit: If any part of social media is going to make money (other than ads and data) it must be shopping. And between the ""younger social media"" crowd (snap, instagram), I guess instagram has got the right interface and community to sell/buy stuff. Isnt this basically competing with $shop? 

I personally know atleast 8 of my friends (few outside the US) who use instagram to sell things (they use it as a market page instead of a website to show their products and you can message them to buy it) bringing this shopping feature would be a great game changer for them. And if they are able to tap a bigger section of audience in other countries, this is going to be big!",2018-03-21 07:22:08
$TCEHY or $MSFT or $FB,2,86k5ph,https://www.reddit.com/r/stocks/comments/86k5ph/tcehy_or_msft_or_fb/,4,1521836175.0,"Looking to add to one of these 3 positions.

FB & TCEHY look the cheapest given their bigger drops, but what do you all think?",2018-03-24 04:16:15
$FB Calls?,38,879e13,https://www.reddit.com/r/stocks/comments/879e13/fb_calls/,67,1522102335.0,Interested. Anyone have any opinions on strike price and expirations? ,2018-03-27 06:12:15
FB advertisers pulling out after $100 Billion loss,555,87bvvb,https://www.reddit.com/r/stocks/comments/87bvvb/fb_advertisers_pulling_out_after_100_billion_loss/,146,1522121077.0,"http://business.financialpost.com/technology/u-s-ftc-investigating-facebooks-privacy-practices

How low can they go? This seems like one of the larger hits other then the sheer monetary loss from the cambridge analytica",2018-03-27 11:24:37
FB is on sale.,0,87bxqe,https://www.reddit.com/r/stocks/comments/87bxqe/fb_is_on_sale/,15,1522121475.0,"Mark my words.

Of course I own FB.

Even if it's just old men and women on facebook, think about it. They don't use ad blockers, and they buy shit. Even if it's just business and retirees, is that really a bad thing?",2018-03-27 11:31:15
Buying FB at discount,73,87hqh5,https://www.reddit.com/r/stocks/comments/87hqh5/buying_fb_at_discount/,137,1522179952.0,"At the end of the day, FB will continue to be at the top of the chain as being a social media conglomerate. All the negative press will soon enough sweep under the rug.  A few whales are definitely lining up to make some big plays on FB. Imo great opportunity in the near future to buy it to keep in one’s long term investments. ",2018-03-28 03:45:52
Buying Fb call option @155. Expiration May 4,9,87kiqd,https://www.reddit.com/r/stocks/comments/87kiqd/buying_fb_call_option_155_expiration_may_4/,25,1522201972.0,Price is $890 .Too risky? What do you guys think?,2018-03-28 09:52:52
"$FB, $TWTR OR $SNAP?",0,87lgh7,https://www.reddit.com/r/stocks/comments/87lgh7/fb_twtr_or_snap/,9,1522208503.0,Which one to buy? go!,2018-03-28 11:41:43
FB actually went up!,8,87vhr5,https://www.reddit.com/r/stocks/comments/87vhr5/fb_actually_went_up/,9,1522299354.0,The bottom might have been hit boys!,2018-03-29 12:55:54
"My strategy in this crazy market.. Invested 100% of my acct in KO, just going to write weekly covered calls and also collect nice dividend..",6,882dpa,https://www.reddit.com/r/stocks/comments/882dpa/my_strategy_in_this_crazy_market_invested_100_of/,17,1522367649.0,"This market is WAY WAY too unstable and volatile for my taste. I use to trade/invest in only tech companies but with bad headline after bad headline and an anti Tech president/Congress, I wouldn't touch them now with free money! They just aren't worth the baggage and headache right now.

So my strategy? Found the most boring, safe and conservative DOW stock I could find, going to park all my cash in it and going to collect steady income from writing covered calls against it weekly and collecting the nice dividend KO pays out on top of that. KO is the PERFECT stock for this market environment in my opinion.

KO is as steady and stable as they come. Even at the height of the 08 financial crisis it was down only 32% while the broader market was down north of 52%",2018-03-30 07:54:09
"Are there any high risk/reward stocks that are like NFLX, NVDA and FB five years ago?",11,88mxu4,https://www.reddit.com/r/stocks/comments/88mxu4/are_there_any_high_riskreward_stocks_that_are/,58,1522570916.0,"Ok, enough is enough. I am tired of seeing 5 year charts of NFLX, NVDA and FB and seeing the ENORMOUS gains in the last 5 years. I am ready to invest big and willing to take some risks.

Obviously I know there isn't a guarantee, but just in some of your guy's opinion, what stocks today would you say most resemble the FB, NFLX and NVDA of 5 years ago and have potential to triple and quadruple?

SQ? AMD now at $10.00? GE now at depressed levels? TWTR or SNAP perhaps OR should I just say screw it and buy all of them? Or is there another company besides the ones I just mentioned?

I am just so sick and tired or missing out on these opportunities, enough is enough! And with all due respect, please don't say ""be smart and invest in blue chips with nice dividends."" 

I've tried that, and while it's been ok, I'm now ready for huge gains",2018-04-01 16:21:56
What’s everyone’s honest opinions about FB?,4,8a0d1b,https://www.reddit.com/r/stocks/comments/8a0d1b/whats_everyones_honest_opinions_about_fb/,29,1522968858.0,"This has probably been asked recently, but do people think FB is a good investment? Personally I cannot picture a world without it, which is why I believe it is a good investment. ",2018-04-06 06:54:18
FB is a strong buy and here's why,0,8aa15k,https://www.reddit.com/r/stocks/comments/8aa15k/fb_is_a_strong_buy_and_heres_why/,35,1523054375.0,"In my opinion Facebook is being unfairly punished. 

Its hack is being treated almost on the same level as Equifax hack. 

You can't really ""hack"" Facebook user data when it's already public. Anyone can create an account and scrape those profile pages. 

It's P/E ratio is fairly low comparing to other tech companies. It has no debt. It's a cash cow. 

Regarding the addiction hate it gets, I think Facebook can make people pursue interesting things. When you see your friends posting pictures of their exciting life, it makes you want to go out and do something so that you can post nice pictures too. 

It's a good time to buy now. What ya'll think?",2018-04-07 06:39:35
ELI5 FB activity today,5,8ab36o,https://www.reddit.com/r/stocks/comments/8ab36o/eli5_fb_activity_today/,16,1523062057.0,"Prior to the open the market was pointing heavily down and fb was trading in the $157 range. Market opens and starts crawling out of it's hole, nasdaq climbs a little faster, so I get why fb would go to the $159-160 range. What I don't understand is how fb could possibly stay out of the 157s, let alone go to it's highest price of the week, all while the market accelerates down and well past it's open, with no positive news coming out about fb and the CEO getting ready to testify in front of Congress next week. What the hell am I missing?",2018-04-07 08:47:37
FB This week,0,8b06ms,https://www.reddit.com/r/stocks/comments/8b06ms/fb_this_week/,8,1523323264.0,Whats the play on FB for this week ? Zuck is heading to the capitol to talk about the data leak.,2018-04-10 09:21:04
Why is FB recovering so fast,187,8bppwy,https://www.reddit.com/r/stocks/comments/8bppwy/why_is_fb_recovering_so_fast/,122,1523564556.0,How is Facebook recovering on the quicker side or is this just a short term jump.,2018-04-13 04:22:36
What to do with $FB,3,8dfh11,https://www.reddit.com/r/stocks/comments/8dfh11/what_to_do_with_fb/,15,1524180336.0,"I'm not a fan of Facebook and don't know much about it, but I picked up 50 shares when it went down to a $151.  I don't have any solid plans, other than I knew it would go up after the data scandal blew over. Now it is up. When should I sell?",2018-04-20 07:25:36
FB Earnings come out on April 25th,4,8dhgo9,https://www.reddit.com/r/stocks/comments/8dhgo9/fb_earnings_come_out_on_april_25th/,14,1524195456.0,"If earnings are better than expected, can we expect a rally? And if earnings are worse, can we expect the stock price to go down?

I don't have a position in FB but I am contemplating it...",2018-04-20 11:37:36
What is going on with FB?,0,8elncg,https://www.reddit.com/r/stocks/comments/8elncg/what_is_going_on_with_fb/,2,1524615384.0,Down 3% today with only a day to go for earnings - are insiders smelling blood?,2018-04-25 08:16:24
$FB Discussion Thread,1,8ewp38,https://www.reddit.com/r/stocks/comments/8ewp38/fb_discussion_thread/,14,1524716061.0,"$FB started all this, remember? Cambridge Analytics Online Math Tutor sunk the stock from 185-165 brought the entire market down with it. With this big beat maybe it will raise the tide. Heres hoping! What are your thoughts.",2018-04-26 12:14:21
If FB is flourishing does that mean SHOP will to?,17,8f2shd,https://www.reddit.com/r/stocks/comments/8f2shd/if_fb_is_flourishing_does_that_mean_shop_will_to/,7,1524779473.0,"If FB beat EPS estimates and actually increased its user base for the quarter - after the Analytica bonanza, does that mean SHOP should bounce up after the Andrew Left showdown.",2018-04-27 05:51:13
FB announced today that they will start doing an online dating service to rival tinder.,328,8gactq,https://www.reddit.com/r/stocks/comments/8gactq/fb_announced_today_that_they_will_start_doing_an/,164,1525225477.0,"[https://www.theverge.com/2018/5/1/17307782/facebook\-tinder\-dating\-app\-f8\-match\-okcupid](https://www.theverge.com/2018/5/1/17307782/facebook-tinder-dating-app-f8-match-okcupid)

MTCH down 20&#37; since announcement. THoughts on whether to buy more MTCH or sell now?",2018-05-02 09:44:37
Do you think that facebook f8 developer conference is affect to good for FB stock?,0,8gfkzg,https://www.reddit.com/r/stocks/comments/8gfkzg/do_you_think_that_facebook_f8_developer/,4,1525274732.0,"I think VR AR tech is main stream like smartphone or mp3 player in the past.
I think VR AR tech will boom up together with 5G. The time maybe next year. 
And facebook announced they are prepare their future item with VR AR. So If many people are agree this, it will affect to stock price.
How do you think about it?",2018-05-02 23:25:32
"In what order do you sell off these stocks? $FB, $AAPL, $AMD, $V (Visa), and $BA (Boeing)?",41,8kxazl,https://www.reddit.com/r/stocks/comments/8kxazl/in_what_order_do_you_sell_off_these_stocks_fb/,82,1526896105.0,"5 very talked about stocks in this sub, as well as other stock forums as well. List in what order you'd sell! Interested in seeing where yall stand on these. ",2018-05-21 17:48:25
"Enough for 1 share of Google, Amazon or a few fb. Looking for 2-5 year growth.",6,8no1x0,https://www.reddit.com/r/stocks/comments/8no1x0/enough_for_1_share_of_google_amazon_or_a_few_fb/,40,1527846360.0,"Whats my better buy?  Or should I be looking elsewhere?  Thank you for the help and assistance, i'm still quite new to all of it.",2018-06-01 17:46:00
"FB and NFLX, time to take profits?",2,8nshs2,https://www.reddit.com/r/stocks/comments/8nshs2/fb_and_nflx_time_to_take_profits/,6,1527893998.0,"Those with FB and NFLX, when do you plan on taking some off the table?",2018-06-02 06:59:58
Alternative of FB & SQ?? Pending buy order,3,8nu7rg,https://www.reddit.com/r/stocks/comments/8nu7rg/alternative_of_fb_sq_pending_buy_order/,8,1527906222.0,"I wanted to get some more FB and SQ, but because of their recent rally, my buy order is pending for 10 days. Should I wait for a dip? Or move on to different stocks? What are some other alternatives?",2018-06-02 10:23:42
How to increase reward-risk ratio?,4,8qc2ts,https://www.reddit.com/r/stocks/comments/8qc2ts/how_to_increase_rewardrisk_ratio/,6,1528772998.0,"Hi,

New trader here looking to swing trade stocks. Not sure if I'm understanding position sizing correctly... assume $10,000 account for the example. The book I'm going through recommends risking 2% maximum and looking for profit objectives between 2-5%.

If I go long on a stock with $2500 and risk $200, a 5% profit would only give me $125, making my reward to risk ratio well under 1. How is it possible to get 2:1 or 3:1 trades? Are 2-5% price swings just not ideal for swing trading? Thanks for the help!",2018-06-12 11:09:58
"AMD, FB, NVDA, CGC, BABA, V?",2,8qurjf,https://www.reddit.com/r/stocks/comments/8qurjf/amd_fb_nvda_cgc_baba_v/,31,1528943236.0,Have 10k to put into one. Looking for highest potential return. I'm okay with risk. Which one would you pick?,2018-06-14 10:27:16
Visa or FB,1,8s5naa,https://www.reddit.com/r/stocks/comments/8s5naa/visa_or_fb/,4,1529407245.0,"I've already bought some shares in MSFT and AAPL. I'm looking to buy one more and I prefer to go with FB, but Visa seems to be everyone's choice here. Should I put half and half in each or should I go all in FB/Visa?",2018-06-19 19:20:45
Tech stocks expected to fall again this week?,0,8va5z3,https://www.reddit.com/r/stocks/comments/8va5z3/tech_stocks_expected_to_fall_again_this_week/,22,1530483315.0,Trade war will legitimately begin after this week. Therefore should we expect tech stocks to drop again this week/afterwards?,2018-07-02 06:15:15
"For being such a fast growth company, how does $FB have a relatively low PE?",15,906k08,https://www.reddit.com/r/stocks/comments/906k08/for_being_such_a_fast_growth_company_how_does_fb/,31,1532041004.0,"FB's PE is 30.64, but for a fast growing tech company I feel as that is fairly low. I'm wondering why the market has given them that low of a PE? And - does this mean that it is relatively priced?

EDIT: They also have a Net Margin of 45% - how has this massive cash flow not produced growth heavily factored in?",2018-07-20 06:56:44
Amazon and FB earnings,1,91nc46,https://www.reddit.com/r/stocks/comments/91nc46/amazon_and_fb_earnings/,5,1532510045.0,"I’d like to load up a few more shares before earnings as I anticipate their movement to be similar to Google. 

From what I’ve researched, they traditionally do well after earnings and have a few percent pop. Some said there is a sell off, but I’d imagine that would be several days after to follow. 

Can anyone speak from experience if I’m on the right track?",2018-07-25 17:14:05
"Advice requested on AMZN, MSFT, GOOGL, AAPL, FB",1,91vl30,https://www.reddit.com/r/stocks/comments/91vl30/advice_requested_on_amzn_msft_googl_aapl_fb/,17,1532579709.0,"I would like to diversify my portfolio and invest about 1500$ in Amazon, Apple, Microsoft, Google or Facebook.

Any advice you can give me?",2018-07-26 12:35:09
FB drop aftermarket,2,91w6rq,https://www.reddit.com/r/stocks/comments/91w6rq/fb_drop_aftermarket/,20,1532583915.0,20% drop aftermarket - if I'm reading this right. Are you seeing this as an opportunity or indication of caution? ,2018-07-26 13:45:15
How much are $fb puts expected to be increased by tommorow?,107,91w7la,https://www.reddit.com/r/stocks/comments/91w7la/how_much_are_fb_puts_expected_to_be_increased_by/,138,1532584069.0,1000% or less? I've had Netflix puts jump 400% the next day on like a 8% drop. Facebook is down 21% right now. Thoughts? I have 65k in puts for the 27th. im numb to the money that's about to come.,2018-07-26 13:47:49
Are you going to buy FB at dip?,30,91wpky,https://www.reddit.com/r/stocks/comments/91wpky/are_you_going_to_buy_fb_at_dip/,97,1532587785.0,"They barely missed the estimate, and the stock dropped 20%. Market is really an irrational guy. Facebook’s PE ratio is not very high for a tech stock. Who else also think this is a great buying opportunity?",2018-07-26 14:49:45
"Yo, wanna buy some FB but my mom has my account how do I convince her?",0,921u5z,https://www.reddit.com/r/stocks/comments/921u5z/yo_wanna_buy_some_fb_but_my_mom_has_my_account/,15,1532637053.0,"I usually just give her money and tell her what stock to put it on, she takes care of the taxes and stuff so no problem but I need an advance from her and she says she won't put it into FB for me since I've unfriended her and she calls it a ""troublesome trend.""",2018-07-27 04:30:53
FB and the world?,3,924f7a,https://www.reddit.com/r/stocks/comments/924f7a/fb_and_the_world/,7,1532655757.0,"So I believe FB is a fundamentally great company that will continue to grow for the foreseeable future, and will profit a lot from emerging economies. Do you think it’s growth will decline or it will be replaced by a better company?",2018-07-27 09:42:37
Will $FB recover?,14,92izmi,https://www.reddit.com/r/stocks/comments/92izmi/will_fb_recover/,48,1532776447.0,Obviously it tumbled due to facebooks new marketing campaign to delete fake profiles and start to connect you to “real” people of who you know. Was this the effect since they had to report their user expectation reach goal and didn’t meet it? ,2018-07-28 19:14:07
$FB lawsuit,0,92jzbx,https://www.reddit.com/r/stocks/comments/92jzbx/fb_lawsuit/,3,1532786698.0,"[https://globenewswire.com/news-release/2018/07/27/1543544/0/en/FACEBOOK-SHAREHOLDER-ALERT-Kaskela-Law-LLC-Announces-Shareholder-Class-Action-Lawsuit-Against-Facebook-Inc-and-Encourages-Investors-with-Losses-in-Excess-of-100-000-to-Contact-the-.html](https://globenewswire.com/news-release/2018/07/27/1543544/0/en/FACEBOOK-SHAREHOLDER-ALERT-Kaskela-Law-LLC-Announces-Shareholder-Class-Action-Lawsuit-Against-Facebook-Inc-and-Encourages-Investors-with-Losses-in-Excess-of-100-000-to-Contact-the-.html)

As the Facebook holder, this is something we need to worry about? I enter at $170 last year",2018-07-28 22:04:58
Did you buy FB stock after the 20% plunge?,9,92yzyn,https://www.reddit.com/r/stocks/comments/92yzyn/did_you_buy_fb_stock_after_the_20_plunge/,37,1532935163.0,"Hi all.
I bought FB after hours at $171 expecting the stock to progressively climb in the coming weeks.
Any of you did the same?
What are your thoughts?",2018-07-30 15:19:23
stocks for long term,4,933ru8,https://www.reddit.com/r/stocks/comments/933ru8/stocks_for_long_term/,10,1532983698.0,"What do you guys think about those stocks below for long term? I'm planning to buy those soon, thanks in advance 

v        

ma

sq

pypl

fb

appl

msft

roku

iq

bzun

ogig",2018-07-31 04:48:18
The best FB article I have read yet..,166,9346fz,https://www.reddit.com/r/stocks/comments/9346fz/the_best_fb_article_i_have_read_yet/,31,1532987117.0,"[https://stratechery.com/2018/facebook-lenses/](https://stratechery.com/2018/facebook-lenses/)

So I follow this guy on Twitter and he posted this recently. Personally, I think he is right on the money. It is 3,600 words but is not too long. Enjoy! 

Twitter account is @benthompson

Also, I am long FB.",2018-07-31 05:45:17
Damn I have made some shit moves lately.,3,9347c9,https://www.reddit.com/r/stocks/comments/9347c9/damn_i_have_made_some_shit_moves_lately/,23,1532987307.0,"I went in hard on NFLX and FB both after their recent crashes. They just keep going down. The market's up today, and I'm down over $200. Days like today make me want to just peace out and put 100% of my holdings in SPY.",2018-07-31 05:48:27
What are the future earnings report dates for FB for the rest of 2018 and 2019?,1,934cwm,https://www.reddit.com/r/stocks/comments/934cwm/what_are_the_future_earnings_report_dates_for_fb/,2,1532988512.0,"I set an order to buy FB at 170 until 31 of July, so I am guessing I now a shareholder of FB. So I am wondering when are the next upcoming earnings reports for this year and the next. I only see the dates of the previous earnings report on websites like NASDAQ.",2018-07-31 06:08:32
"FB, PYPL and SQ.... Both have taken a fall today. Which stands out more?",0,937fao,https://www.reddit.com/r/stocks/comments/937fao/fb_pypl_and_sq_both_have_taken_a_fall_today_which/,3,1533009467.0,"Since all of these stocks have taken a 2%-6% fall today, I have been thinking on capitalizing on their downturn. They all seem to be very well known and profitable companies but deciding on which wave to ride for the long term is difficult. Opinions and advice welcome!",2018-07-31 11:57:47
FB or MSFT?,22,948flq,https://www.reddit.com/r/stocks/comments/948flq/fb_or_msft/,62,1533320808.0,"If you could only choose one to invest in, which would you choose?",2018-08-04 02:26:48
